{
  "id": "fugitive",
  "edition": "custom",
  "image": [
    "https://github.com/yoyosource/BOTC-FoF/blob/master/Traveller/Fugitive/image.png?raw=true",
    "https://github.com/yoyosource/BOTC-FoF/blob/master/Traveller/Fugitive/image_good.png?raw=true",
    "https://github.com/yoyosource/BOTC-FoF/blob/master/Traveller/Fugitive/image_evil.png?raw=true"
  ],
  "name": "Fugitive",
  "team": "traveller",
  "otherNightReminder": "Wake up a living player and have them choose either 1 or 2, then put them to sleep.\nWake up another living player and have them choose 1 or 2, then put them to sleep.\n  If at least 1 of them choose 1, put a Good Potion on the other player.\n  If only 1 of them chose 2, wake them and show them the other player and their potions.\n  If both players chose 2, put an evil potion on both.",
  "ability": "Each night* 2 players choose either 1) The other receives a Good potion, or 2) to learn the other and their potions. If both choose 2, each receive an Evil potion instead.",
  "flavor": "I've run so far away,\nI ran all night and day,\nso far away,\nbut I couldn't get away.",
  "special": [
    {
      "type": "signal",
      "name": "card",
      "value": "makes you an offer. Pick 1 or 2.",
      "time": "night"
    },
    {
      "type": "signal",
      "name": "card",
      "value": "makes you an offer. Pick 1 or 2.",
      "time": "night",
      "global": "outsider"
    },
    {
      "type": "signal",
      "name": "card",
      "value": "makes you an offer. Pick 1 or 2.",
      "time": "night",
      "global": "minion"
    },
    {
      "type": "signal",
      "name": "card",
      "value": "makes you an offer. Pick 1 or 2.",
      "time": "night",
      "global": "demon"
    },
    {
      "type": "signal",
      "name": "card",
      "value": "makes you an offer. Pick 1 or 2.",
      "time": "night",
      "global": "traveller"
    }
  ]
}