{
  "id": "socialist",
  "edition": "custom",
  "image": [
    "https://github.com/yoyosource/BOTC-FoF/blob/master/Traveller/Socialist/image.png?raw=true",
    "https://github.com/yoyosource/BOTC-FoF/blob/master/Traveller/Socialist/image_good.png?raw=true",
    "https://github.com/yoyosource/BOTC-FoF/blob/master/Traveller/Socialist/image_evil.png?raw=true"
  ],
  "name": "Socialist",
  "team": "traveller",
  "ability": "Up to three times each night when a player receives a potion (not from the Socialist); another player receives a potion of the opposite alignment.",
  "flavor": "The workers must seize the means of production!"
}