{
  "id": "thug",
  "edition": "custom",
  "reminders": [
    "Mad"
  ],
  "image": [
    "https://github.com/yoyosource/BOTC-FoF/blob/master/Minion/Thug/image.png?raw=true",
    "https://github.com/yoyosource/BOTC-FoF/blob/master/Minion/Thug/image_good.png?raw=true"
  ],
  "name": "Thug",
  "team": "minion",
  "firstNightReminder": "Wake up the Thug and have them choose a player and a character. Put the Thug's *Mad* reminder token on that player. Put the Thug to sleep and wake up the chosen player. Inform them that they were chosen by the Thug and the character chosen by the Thug.",
  "otherNightReminder": "Wake up the Thug and have them choose a player and a character. Put the Thug's *Mad* reminder token on that player. Put the Thug to sleep and wake up the chosen player. Inform them that they were chosen by the Thug and the character chosen by the Thug.",
  "ability": "Each night, choose a player and a character; tomorrow they are \"mad\" that that character is NOT in play or 2 players might receive an evil potion.",
  "flavor": "You're humming, Sam. That means that something awful is going to happen to somebody."
}