{
  "id": "auctioneer",
  "edition": "custom",
  "reminders": [
    "Market Day (Tomorrow)",
    "Market Day (Today)"
  ],
  "image": [
    "https://github.com/yoyosource/BOTC-FoF/blob/master/Townsfolk/Auctioneer/image.png?raw=true",
    "https://github.com/yoyosource/BOTC-FoF/blob/master/Townsfolk/Auctioneer/image_evil.png?raw=true"
  ],
  "name": "Auctioneer",
  "team": "townsfolk",
  "otherNightReminder": "If today was a Market Day wake up the Auctioneer and signal them how many evil players traded tonight.",
  "ability": "Once per game, during the day publicly declare tomorrow to be Market Day. The night after a Market Day learn how many evil players traded.",
  "flavor": "Aaaaaaaand, sold to the robed stranger with the pitchfork!"
}