{
  "id": "thecauldron",
  "edition": "custom",
  "reminders": [
    "Eyed the Cauldron",
    "Eyed the Cauldron",
    "Eyed the Cauldron",
    "Eyed the Cauldron",
    "Eyed the Cauldron",
    "Eyed the Cauldron",
    "Eyed the Cauldron",
    "Eyed the Cauldron",
    "Eyed the Cauldron",
    "Eyed the Cauldron",
    "Eyed the Cauldron",
    "Eyed the Cauldron",
    "Eyed the Cauldron",
    "Eyed the Cauldron",
    "Eyed the Cauldron",
    "Eyed the Cauldron",
    "Eyed the Cauldron",
    "Eyed the Cauldron",
    "Eyed the Cauldron",
    "Eyed the Cauldron",
    "Flipped Potions",
    "Flipped Potions",
    "Flipped Potions",
    "Flipped Potions",
    "Flipped Potions",
    "Flipped Potions",
    "Flipped Potions",
    "Flipped Potions",
    "Flipped Potions",
    "Flipped Potions",
    "Flipped Potions",
    "Flipped Potions",
    "Flipped Potions",
    "Flipped Potions",
    "Flipped Potions",
    "Flipped Potions",
    "Flipped Potions",
    "Flipped Potions",
    "Flipped Potions",
    "Flipped Potions"
  ],
  "name": "The Cauldron",
  "team": "fabled",
  "image": [
    "https://github.com/yoyosource/BOTC-FoF/blob/master/Fabled/TheCauldron/image.png?raw=true"
  ],
  "ability": " ",
  "flavor": "The Pot might be calling the Kettle black, but everyone agrees that the Cauldron is green."
}