{
  "id": "scout",
  "edition": "custom",
  "image": [
    "https://github.com/yoyosource/BOTC-FoF/blob/master/Townsfolk/Scout/image.png?raw=true",
    "https://github.com/yoyosource/BOTC-FoF/blob/master/Townsfolk/Scout/image_evil.png?raw=true"
  ],
  "setup": true,
  "name": "Scout",
  "team": "townsfolk",
  "firstNightReminder": "Wake the Scout and signal a number equal to the highest number of Townsfolk players sitting in a line.",
  "ability": "You start knowing the longest chain of Townfolk players. [+0/+1 Outsiders]",
  "special": [
    {
      "type": "signal",
      "name": "card",
      "value": "The longest chain of townsfolk players is:",
      "time": "firstNight"
    }
  ]
}