{
  "id": "solicitor",
  "edition": "custom",
  "otherNightReminder": "Remove any *No Ability* Reminder token. Put the *No Ability* Reminder on any Townsfolk with any *Trade* Reminder token on them.",
  "reminders": [
    "Trade 1",
    "Trade 1",
    "Trade 2",
    "Trade 2",
    "Trade 3",
    "Trade 3",
    "Trade 4",
    "Trade 4",
    "Trade 5",
    "Trade 5",
    "Trade 6",
    "Trade 6"
  ],
  "name": "Solicitor",
  "team": "fabled",
  "image": [
    "https://github.com/yoyosource/BOTC-FoF/blob/master/Fabled/Solicitor/image.png?raw=true"
  ],
  "ability": "2 living players may publicly choose to trade all potions once per day. If either player is dead when the trade would happen, no trade occurs.",
  "flavor": "Oh, I love the Festival! It's my busiest workday of the year!"
}