{
  "id": "student",
  "edition": "custom",
  "image": [
    "https://github.com/yoyosource/BOTC-FoF/blob/master/Outsider/Student/image.png?raw=true",
    "https://github.com/yoyosource/BOTC-FoF/blob/master/Outsider/Student/image_evil.png?raw=true"
  ],
  "name": "Student",
  "team": "outsider",
  "ability": "You may only vote or nominate if you have a trade active.",
  "flavor": "Education is not the filling of a pail, but the lighting of a fire."
}