{
  "id": "chemist",
  "edition": "custom",
  "image": [
    "https://github.com/yoyosource/BOTC-FoF/blob/master/Minion/Chemist/image.png?raw=true",
    "https://github.com/yoyosource/BOTC-FoF/blob/master/Minion/Chemist/image_good.png?raw=true"
  ],
  "name": "Chemist",
  "team": "minion",
  "firstNightReminder": "Wake up the Chemist and show them the *Cauldron*. Have them choose either 1 or 2. If they choose 1, have them choose 2 potions in the Cauldron and then swap those potion's places. If they choose 2, have them choose a good potion held by another player; move it to them and replace it with an Empty Potion.",
  "otherNightReminder": "Wake up the Chemist and show them the *Cauldron*. Have them choose either 1 or 2. If they choose 1, have them choose 2 potions in the Cauldron and then swap those potion's places. If they choose 2, have them choose a good potion held by another player; move it to them and replace it with an Empty Potion.",
  "ability": "Each night, eye the cauldron; either choose 1) 2 potions to swap places, or 2) a good potion another player holds; you receive it, theirs is emptied.",
  "flavor": "Life is just chemicals. A drop here, a drip there, everything's changed."
}