{
  "id": "pigeonfancier",
  "edition": "custom",
  "image": [
    "https://github.com/yoyosource/BOTC-FoF/blob/master/Townsfolk/PigeonFancier/image.png?raw=true",
    "https://github.com/yoyosource/BOTC-FoF/blob/master/Townsfolk/PigeonFancier/image_evil.png?raw=true"
  ],
  "name": "Pigeon Fancier",
  "team": "townsfolk",
  "ability": "While dead, if you died at night, the Glassblower only gives out good potions. [+Glassblower]"
}