{
  "id": "apothecary",
  "edition": "custom",
  "image": [
    "https://github.com/yoyosource/BOTC-FoF/blob/master/Townsfolk/Apothecary/image.png?raw=true",
    "https://github.com/yoyosource/BOTC-FoF/blob/master/Townsfolk/Apothecary/image_evil.png?raw=true"
  ],
  "name": "Apothecary",
  "team": "townsfolk",
  "ability": "All types of potions you are holding are nullified.",
  "flavor": "Medicine is not only a science; it is also an art. It does not consist of compounding pills and plasters; it deals with the very processes of life, which must be understood before they may be guided."
}